Startup,One liner,Website,Country,LinkedIn,Founded,Funding $m,Funding stage,Climate category,Climate subcategories,Stage,Investors,Team 1 Name,Team 1 LinkedIn,Team 1 Title,Team 2 Name,Team 2 LinkedIn,Team 2 Title,Team 3 Name,Team 3 LinkedIn,Team 3 Title,Team 4 Name,Team 4 LinkedIn,Team 4 Title,Team 5 Name,Team 5 LinkedIn,Team 5 Title,Team 6 Name,Team 6 LinkedIn,Team 6 Title
ECKlien4Ras,Specializes in land-based Recirculating Aquaculture Systems (RAS) using innovative Electro-Coagulation technology for sustainable seafood production.,https://ecklien4ras.com,India,,2022,,Pre-Seed,Food & land use,Aquaculture,R&D,,Manimaran Baskaran,https://www.linkedin.com/in/manimaran-baskaran-8063091b/?originalSubdomain=in,Founder and CEO,,,,,,,,,,,,,,,
Scion Algae,"Advanced algae cultivation technology, producing high-value nutraceuticals and vegan proteins.",,India,https://www.linkedin.com/in/scion-algae-ba3877243/,2021,,Pre-Seed,Food & land use,"Alternative foods, Aquaculture",R&D,,Sai Krishna P,https://www.linkedin.com/in/sai-krishna-p-812152a/,Managing Director,,,,,,,,,,,,,,,
Zero Earth Company,Sustainable dairy by reducing methane emissions through innovative seaweed-based feed additives.,https://zeroearth.company,India,https://www.linkedin.com/company/zeroearth/,2023,,Pre-Seed,"Food & land use, Climate management","Livestock, Sustainable finance",R&D,,Ani Varghese,https://www.linkedin.com/in/ani-g-varghese/,Founder,Smitha V,https://www.linkedin.com/in/smitha-v-4b213722/,Co-founder and Executive Director,,,,,,,,,,,,
KriSHE Carbon,KriSHE aims to democratize carbon markets for Indian smallholder farmers by incentivizing sustainable agricultural practices and helping them sell carbon credits.,,India,https://www.linkedin.com/company/krishe-carbon/,2024,,Pre-Seed,"Food & land use, Carbon",Carbon marketplace,R&D,,Anjali Rose,https://www.linkedin.com/in/anjali-rose-b5a065183/,Co-founder,Naga Sai Krishna Bodavula,https://www.linkedin.com/in/naga-sai-krishna-bodavula-778549253/,Co-founder,,,,,,,,,,,,
Ocean Vital Aquatics,"Provides sustainable, seaweed-based solutions to enhance animal and human health, boost farm productivity, and promote eco-friendly practices.",,India,,0,,Pre-Seed,Food & land use,Aquaculture,R&D,,Aathreya,https://www.linkedin.com/in/aquatic/,Founder & Product Innovator,,,,,,,,,,,,,,,
Uncompromised,"Farmers & Engineers, building climate-resilient, regenerative farms through innovations in science and technology.",https://uncompromised.in,India,https://www.linkedin.com/company/uncompromised-world/,2023,,Pre-Seed,Food & land use,Crop yield,R&D,,Sikander Siraj,https://www.linkedin.com/in/sikander-siraj/,Co-founder & CEO,Krati Modi,https://www.linkedin.com/in/krati-modi-b14a01109/,Co-founder,Saurabh Singhvi,https://www.linkedin.com/in/saurabhsinghvi/,Founder,Ashima Goyal Siraj,https://www.linkedin.com/in/ashimagoyalsiraj/,Co-founder,,,,,,
Terracusto,Biogenic carbon removal by transforming biomass burning into profitable biochar production.,,India,https://www.linkedin.com/company/terracusto/,2023,,Pre-Seed,"Food & land use, Carbon",Carbon removal,R&D,,Nipun Sawhney,,Co-founder and CEO,Aditi Goswami,,Co-founder and CTO,,,,,,,,,,,,
Biome / Build,Alternative building materials made from nature's waste.,https://biome.build,India,https://www.linkedin.com/company/biomebuild/,2024,,Pre-Seed,Built environment,Construction,R&D,,Sumeet Popli,https://www.linkedin.com/in/sumeetpopli/,Founder,,,,,,,,,,,,,,,
Maini Renewables,Harnessing the power of water with damless hydrokinetic turbines—redefining renewable energy for a sustainable future.,https://www.mainirenewables.com,India,https://www.linkedin.com/company/maini-renewables/about/,2021,,Pre-Seed,Energy,"DERs - Distributed energy resources, Renewables development",Pilot,,Swati Maini,https://www.linkedin.com/in/mainiswati/,Founder,,,,,,,,,,,,,,,
IGoWise,"Smart, compact, and sustainable twin-wheeled trike vehicle for emerging markets.",https://www.igowise.com,India,https://www.linkedin.com/company/igotwikes/about/,2020,5,Seed,"Energy, Transportation",Micromobility,Pilot,,Chaitanya Eswarapragada,https://www.linkedin.com/in/chaitanyae/,CEO,Suresh Babu Salla,https://www.linkedin.com/in/suresh-babu-salla-92730323/,CTO,,,,,,,,,,,,
MyPickup,"Provides subscription based electric auto-rickshaw service for daily commutes to office-goers, school children, etc.",https://mypickup.in,India,https://www.linkedin.com/company/mypickup/about/,2022,0.323,Seed,Transportation,Micromobility,Launch,Inflection Point Venture,Abhijeet Jagtap,https://www.linkedin.com/in/abhijeet-jagtap1/,Founder,,,,,,,,,,,,,,,
VSRI Energy Solutions,"A provider of hydrogen retrofitting technologies enabling gasoline engines to run on hydrogen fuel, offering a cost-effective solution to reduce emissions without the need for major engine modifications.",https://www.vsrienergy.com,India,https://www.linkedin.com/company/vsri-energy-solutions-pvt-ltd/about/,2023,,Pre-Seed,Energy,Hydrogen,R&D,,Srikanth Vaddi,https://www.linkedin.com/in/srikanth-vaddi-9359aa281/,Founder & CEO,,,,,,,,,,,,,,,
deMITasse Energies,"Building efficient, reliable, inexpensive zero-emission power plants with long-duration grid-scale energy storage.",http://demitasse.tech,India,https://www.linkedin.com/company/demitasse-energies/about/,2011,10,Series A,Energy,Energy storage,Pilot,NSRCEL-IIMB,Vijay Prateik,https://www.linkedin.com/in/vijayprateik/,Founder and CEO,,,,,,,,,,,,,,,
Visarj Systems,"Providing immersion cooling solutions that significantly reduce energy, water, and space usage, while enhancing hardware efficiency and lifespan for data centers and electric vehicle batteries.",https://visarj.in,India,https://www.linkedin.com/company/visarj/about/,2023,,Pre-Seed,Industry,"Energy efficiency, Heating & cooling",Launch,,Aditya Kaul,https://www.linkedin.com/in/aditya-kaul-b4567a3a/,Co-founder,,,,,,,,,,,,,,,
Hydrium Energy,"Develops hydrogen fuel cell systems for heavy-duty mobility solutions, aiming for zero-emission logistics and advanced propulsion technologies.",https://hydriumenergy.com,India,https://www.linkedin.com/company/hydriumenergy/about/,2023,,Pre-Seed,Energy,Hydrogen,R&D,,Monish Ram,https://www.linkedin.com/in/monish-ram-58707047/,Co-founder,,,,,,,,,,,,,,,
E-Samarp Technologies,"E-Samarp Technologies designs cost-effective electric motors with reduced reliance on rare earth magnets, optimizing efficiency for electric vehicles and industrial applications.",https://www.esamarp.com,India,https://www.linkedin.com/company/e-samarp-technologies-pvt-ltd/about/,2022,,Pre-Seed,"Industry, Transportation","Energy efficiency, EV charging / fleet management",Pilot,,V Rajini,,Co-Founder and Director,Nagarajan V S,https://www.linkedin.com/in/nagarajan-v-s-822bb7a6/,Co-Founder and Director,,,,,,,,,,,,
BES Private Limited,"Compact, high-efficiency vertical-axis wind turbines.",https://www.bhaskaraengg.com,India,https://www.linkedin.com/company/bhaskara-engineering-services-pvt-ltd/about/,2022,,Pre-Seed,Energy,"Renewables development, Solar",Prototype,,Raju Govindharajan,https://www.linkedin.com/in/raju-govindharajan-98011417/,Director & CTO,Indhumathy Basker,https://www.linkedin.com/in/indhumathy-basker-6b8169147/,"Founder, Director & CEO",,,,,,,,,,,,
Watthour24,"Developing scalable sodium-ion batteries, leveraging earth-abundant materials for a geopolitically secure supply chain.",,India,,2022,,Pre-Seed,Transportation,Batteries,R&D,,Milind Kumar,https://www.linkedin.com/in/milind-kumar-71b0b8174/,Founder and CEO,,,,,,,,,,,,,,,
Shakti Photon Solutions Private Limited,Developing cost-effective PEM and AEM electrolyzers for scalable green hydrogen production.,https://www.shaktiphotonsolutions.com,India,https://www.linkedin.com/company/shakti-photon-solutions-private-limited/?originalSubdomain=in,2023,,Pre-Seed,Energy,"Hydrogen, Energy storage",R&D,,Dr. Mallikarjuna Rao MOTAPOTHULA,https://www.linkedin.com/in/dr-mallikarjuna-rao-motapothula-22268a34/,Founder and Director,Noah Jacob,https://www.linkedin.com/in/noah-jacob-901578174/,CTO,,,,,,,,,,,,
Evate,"A climate-focused platform offering accessible and affordable vehicle financing to empower drivers with vehicle ownership, targeting the transition to green transportation.",https://evatetech.com,India,https://www.linkedin.com/company/evatetech/about/,2023,0.042,Seed,"Climate management, Transportation","Sustainable finance, Micromobility",Pilot,,Vijay H Madhusudan,https://www.linkedin.com/in/vijay-hm/,Co-founder,Amit Shahani,https://www.linkedin.com/in/amitshahani/,Co-founder,,,,,,,,,,,,
Resilience,"Develops affordable lithium-ion energy storage solutions for businesses, reducing peak-hour electricity costs with modular battery systems.",,India,,0,,Pre-Seed,Energy,Energy storage,R&D,,,,,,,,,,,,,,,,,,,
Warar Energy Pvt Ltd,Designing cost-effective electric vehicles optimized for last-mile urban logistics and cargo mobility.,https://wararenergy.com,India,https://www.linkedin.com/company/wararenergy/about/,2021,,Seed,"Energy, Transportation",EV charging / fleet management,Pilot,Maharashtra State Innovation Society,Prabu Gnanasekaran,https://www.linkedin.com/in/prabu-g-8614196b/,Founder and Director,,,,,,,,,,,,,,,
BioSky Technologies,Driving precision and efficiency in renewable energy and infrastructure with advanced space-based intelligence.,https://biosky.tech,India,https://www.linkedin.com/company/biosky-technologies/,2024,,Pre-Seed,Energy,Renewables development,R&D,,Saurabh Kapil,,,,,,,,,,,,,,,,,
Energy Flow,Long-duration sulfur-iron flow batteries.,,India,,0,,,Energy,Energy storage,,,,,,,,,,,,,,,,,,,,
Aatral ESP,"Developing sodium-ion batteries as a sustainable, cost-effective, and eco-friendly alternative to lithium-ion batteries for solar energy storage.",https://www.aatral-esp.com,India,https://www.linkedin.com/company/aatral-esp/about/,2022,,Pre-Seed,"Energy, Transportation","Energy storage, Batteries",Pilot,,Subathra Rajendran,https://www.linkedin.com/in/suba-thra-9625b217/,CEO,Ashok Kumar,https://www.linkedin.com/in/ashok-kumar-4a1833271/,CTO,,,,,,,,,,,,
iAC,Implementing AI-driven retrofit solutions to enhance thermal efficiency and reduce energy consumption in existing air conditioning systems.,http://smdp.in,India,https://www.linkedin.com/company/smdpower/about/,2016,,Pre-Seed,Industry,"Energy efficiency, Heating & cooling",Launch,"FIED Incubator, VJTI-TBI",Vishwesh Bhat,https://www.linkedin.com/in/vishwesh-bhat-039b9b106/,Founder,,,,,,,,,,,,,,,
Tamira Bot,"Developing advanced EV charging solutions with improved thermal efficiency, longer lifespan, and faster charging, using indigenously manufactured technology.",https://tamirabot.com,India,https://www.linkedin.com/company/tamirabot/about/,2023,,Pre-Seed,"Industry, Transportation","Energy efficiency, Heating & cooling, EV charging / fleet management",Launch,,Valliammal P,,Director,Velayutham S,https://www.linkedin.com/in/velayutham01/,Founder & Director,,,,,,,,,,,,
Wankel Energy Systems,"Develops energy-efficient steam-to-power solutions, maximizing industrial energy savings and reducing carbon emissions.",https://wankel.in,India,https://www.linkedin.com/company/wankelenergysystems/about/,2022,,Pre-Seed,Industry,Energy efficiency,Pilot,"Forge Ventures, IIT Madras Incubation Cell",Gautam Subburaj,https://www.linkedin.com/in/gautam-subburaj-25979aab/,Co-founder,Balachandran R.,https://www.linkedin.com/in/balachandranraju/,Co-founder,Vipin Venugopal,https://www.linkedin.com/in/vipin-venugopal-5bb2a7116/,Co-founder and Director,Satyanarayanan Seshadri,https://www.linkedin.com/in/satyaseshadri/,Co-founder and Director,,,,,,
Hivericks Technology,Developing AI-enabled Cleantech charging accessories to optimize battery life and reduce energy consumption for smart devices in corporate and smart building environments,https://www.hivericks.com,India,https://www.linkedin.com/company/hivericks/about/,2018,0.072,Seed,Industry,"Energy efficiency, Heating & cooling",Pilot,"AIC T-hub, IITM Pravartak, Gyan Circle Ventures",Arun Natesan,https://www.linkedin.com/in/arun-skg/,CEO and Founder,,,,,,,,,,,,,,,
H-BAR OMEGA,Solar PV diagnostics with multi-modal imaging technology for defect detection and performance forecasting for solar modules.,https://hbaromega.com,India,,2019,,Pre-Seed,Energy,Solar,Pilot,IITM Pravartak,Narayan K. S.,https://www.linkedin.com/in/narayan-k-s-59664a4/,Co-founder & CEO,Prashant Kumar,https://www.linkedin.com/in/prashant-kumar-8ab115135/,Co-founder & Director/CTO,,,,,,,,,,,,
SiriNor,Developing an electric jet engine designed to reduce greenhouse gas emissions in aviation through hydrogen-electric propulsion.,https://www.sirinor.com,India,https://www.linkedin.com/company/sirinor/about/,2021,0.402,Seed,"Transportation, Energy","Aviation, Hydrogen",Pilot,Shell E4,Ivar Aune,https://www.linkedin.com/in/ivar-aune-b4279648/,CEO,,,,,,,,,,,,,,,
Vayve Mobility,"Developing solar-electric city cars designed for urban commuters with a focus on sustainability, affordability, and ease of use.",https://www.evayve.com,India,https://www.linkedin.com/company/vayve-mobility/about/,2021,,Seed,Transportation,Micromobility,Pilot,"Cleantech Open, Leading Cities",Nilesh Bajaj,https://www.linkedin.com/in/nileshbajaj/,Co-founder and CEO,Ankita Jain,https://www.linkedin.com/in/ankita-jain1/,Co-founder,Saurabh Mehta,https://www.linkedin.com/in/saurabhhere/,Co-founder,Vilas Deshpande,https://www.linkedin.com/in/vilas-deshpande/,Co-founder & COO,,,,,,
Ambiator,Climate-appropriate cooling / HVAC solutions that cut energy use and carbon emissions.,https://www.ambiator.com,India,https://www.linkedin.com/company/ambiator/about/,2022,,Seed,Industry,"Energy efficiency, Heating & cooling",Launch,"AIC T-hub, T-Hub",Tiger Aster,https://www.linkedin.com/in/tigeraster/,Founder,Jeeten Desai,https://www.linkedin.com/in/jeetendesai/,Co-founder,,,,,,,,,,,,
VASSMAAN QUILL,"Innovates with TORK-Z, an advanced gear technology that increases energy efficiency, reduces operational costs, and supports sustainability across industries.",https://www.quilltechno.com,India,,0,,Pre-Seed,Industry,"Energy efficiency, Heating & cooling",,,,,,,,,,,,,,,,,,,,
RF Power,"A portable power station offering eco-friendly and affordable electricity to power household devices and appliances, aiming to replace traditional diesel generators with clean energy solutions.",,India,,0,,Pre-Seed,Industry,"Energy efficiency, Heating & cooling",,,,,,,,,,,,,,,,,,,,
Austhraa Motors,A light weight utility electric vehicle company that aims to develop a resource efficient electric Micro-Mobility Ecosystem.,https://austhraa.com,India,https://www.linkedin.com/company/austhraa-motors/about/,2020,,Seed,Transportation,"EV charging / fleet management, Micromobility",Launch,"AIC T-hub, T-Hub",Karthik Raju Bavana,https://www.linkedin.com/in/karthik-raju-bavana-b43a94149/,Founder and CEO,Pradeep Kondeti,https://www.linkedin.com/in/pradeep-kondeti-2557131a3/,Director,,,,,,,,,,,,
280Carbon,"Modular electrolyzers convert captured CO₂ into ethylene-based polymers, enabling scalable CCUS solutions.",https://www.280carbon.com,India,https://www.linkedin.com/company/280-carbon/about/,2023,,Pre-Seed,Carbon,Carbon capture & storage,R&D,,Neville Patel,https://www.linkedin.com/in/neville-patel-63b38439/,Founder and CEO,,,,,,,,,,,,,,,
NorthStar Impact Solution,"A SaaS platform providing businesses with sustainability performance benchmarking, ESG compliance, and actionable insights through AI-driven analytics and customizable dashboards.",https://www.northstarimpactsolution.com,India,https://www.linkedin.com/company/northstar-impact-solution/about/,2023,,Seed,Climate management,,R&D,IIT Mandi Catalyst,Vamsi Krishna Korasiga,https://www.linkedin.com/in/vamsi-krishna-korasiga-12542815/,Co-founder and CTO,Vasudha Saraogi,https://www.linkedin.com/in/vasudha-saraogi-8899461a1/,Founder & CEO,,,,,,,,,,,,
Bacuti,"A SaaS platform for sustainability reporting, helping companies to report their carbon emissions, including Scope 3",https://www.bacuticorp.com,India,https://www.linkedin.com/company/bacuti/about/,2024,,Pre-Seed,Climate management,Emissions reporting,R&D,,Rajesh S.,https://www.linkedin.com/in/rajeshsrinivasaraghavan/,Co-founder,,,,,,,,,,,,,,,
Hypersonic Technologies Pvt Ltd,"Innovating hydrogen and carbon fiber production through plasma pyrolysis technology to offer a scalable, low-carbon, and cost-effective solution for clean energy and material production.",https://hypersonics.in,India,,2023,,Pre-Seed,"Industry, Energy",Hydrogen,R&D,,Jayaraman Kandasamy,https://www.linkedin.com/in/jayaraman-kandasamy-a69b3627/,CEO & Director,,,,,,,,,,,,,,,
RangBio,"Eco-friendly, microbial bio-colors for textiles that slash pollution, water usage, and carbon emissions.",https://www.rangbio.com,India,,2022,,Seed,Industry,Textiles,R&D,,Revathi Ravishankar,https://www.linkedin.com/in/revathi-ravishankar-33b6ba48/,Founder and CEO,,,,,,,,,,,,,,,
EnergyETA,"Provides AI-driven IoT solutions for energy efficiency and predictive maintenance, optimizing energy use in commercial and industrial buildings.",https://www.energyeta.ai,India,https://www.linkedin.com/company/energyeta/about/,2022,,Pre-Seed,"Energy, Built environment",Energy efficiency,Pilot,,Satyanarayanan Seshadri,https://www.linkedin.com/in/satyaseshadri/,Co-founder and Director,Jayesh Jain,https://www.linkedin.com/in/jayeshprofile/,Co-founder and MD,Jagjit Singh,https://www.linkedin.com/in/saini-jagjit/,Co-founder,,,,,,,,,
BlackRhino,"Provides AI and automation-driven climate management solutions to help enterprises enhance sustainability efforts, improve resource efficiency, and boost brand reputation.",http://www.blackrhinoz.com,India,https://www.linkedin.com/company/blackrhino/about/,2023,,Pre-Seed,"Climate management, Carbon",Emissions reporting,Pilot,,,,,,,,,,,,,,,,,,,
Diffuson Coatech,"Transforming surface engineering with proprietary diffusion coatings, enhancing wear resistance and durability across industrial applications.",https://www.diffuson.in,India,https://www.linkedin.com/company/diffuson-coatech/about/,2020,,Pre-Seed,Industry,Manufacturing,Pilot,"PSG-Science and Technology Entrepreneurial Park (PSG-STEP), Startup Nexus",Atul SC,https://www.linkedin.com/in/scatul/,Founder and CEO,,,,,,,,,,,,,,,
Carbon Compete,Decarbonization with AI-driven SaaS for end-to-end supply chain transparency,https://carboncompete.com,India,https://www.linkedin.com/company/carboncompete/about/,2022,0.108,Pre-Seed,"Climate management, Carbon",Carbon removal,Pilot,,Sundar Kannan,https://www.linkedin.com/in/sundar-kannan-494b072/,Founder and CEO,Vishwakarma J S,https://www.linkedin.com/in/vishwakarmajs/,CSO,,,,,,,,,,,,
MetroRide Kids,"Safe, reliable electric mobility tailored for kids with IoT-enabled vehicles and stringent processes",https://kids.metroride.com,India,https://www.linkedin.com/company/metrorideind/about/,2020,16.8,Series A,Transportation,Micromobility,Scale-up,,Girish Nagpal,https://www.linkedin.com/in/girishnagpal/,Co-founder and CEO,Kaaman Agarwal,https://www.linkedin.com/in/kaaman/,Co-founder and CTO,,,,,,,,,,,,
VAPAC,"A sustainable packaging solution utilizing agricultural waste, including coffee husks, to produce eco-friendly corrugated cardboard and reduce deforestation and carbon emissions.",https://www.vapac.in,India,https://www.linkedin.com/company/vapac-bio-plastics/,2022,,Pre-Seed,Industry,Packaging,R&D,,Vikas Shetty,,,,,,,,,,,,,,,,,
Scrapify Ecotech Pvt. Ltd,"Developing autonomous water drones with AI-based navigation and real-time monitoring for efficient cleaning of water bodies, including waste collection, oil spill skimming, and algae bloom control.",https://scrapifyecotech.in,India,https://www.linkedin.com/company/scrapify-ecotech-private-limited/about/,2022,0.021,Seed,Industry,"Waste & recycling, Wastewater",Prototype,"Crescent Innovation and Incubation Council (CIIC), PSG-Science and Technology Entrepreneurial Park (PSG-STEP)",Azhagu Pandia Raja M P,https://www.linkedin.com/in/azhagu/,Founder & CEO,,,,,,,,,,,,,,,
GreenJams,"Produces Agrocrete®, a carbon-negative building material made from crop residues and industrial by-products, offering a sustainable alternative to traditional concrete.",https://greenjams.org,India,https://www.linkedin.com/company/thegreenjams/about/,2019,0.369,Seed,"Carbon, Built environment","Carbon removal, Construction",Pilot,"Villgro, ClimateLaunchpad, Leading Cities",Tarun Jami,https://www.linkedin.com/in/tarunjami/,Founder and CEO,,,,,,,,,,,,,,,
Kaashyap,"Produces BioCNG from organic waste and treats wastewater for reuse, focusing on renewable energy and sustainability initiatives across India and Malaysia.",https://kaashyapenvergy.com,India,,2018,,Seed,Industry,"Waste & recycling, Wastewater",Pilot,,Kiran KK,,,,,,,,,,,,,,,,,
Thaal Innovations,"Offering a solution to recycle polyurethane foam waste, converting it into raw materials for reuse, significantly reducing landfill impact.",https://thaalinnovations.com,India,,2023,,Pre-Seed,Industry,Waste & recycling,R&D,,Devi Ramamoorthy,https://www.linkedin.com/in/devi-ramamoorthy-6b864928/,Founder,,,,,,,,,,,,,,,
Earthworks Biomat,Focuses on creating biodegradable materials from agro-waste,https://www.earthworks.bio,India,https://www.linkedin.com/company/earthworks-biomat-pvt-ltd/about/,2024,,Pre-Seed,Energy,Waste biomass,R&D,,Trupti Arabatti,https://www.linkedin.com/in/trupti-arabatti/,Founder and CEO,,,,,,,,,,,,,,,
Li Circle,Recycling end-of-life Lithium-ion batteries.,https://www.licircle.com,India,https://www.linkedin.com/company/licircle/about/,2020,,Seed,Industry,Waste & recycling,Pilot,Climate Collective,Santosh Kumar J,https://www.linkedin.com/in/santosh-kumar-j-096a19118/,Founder,,,,,,,,,,,,,,,
Eunoia Innovations Private Limited,"Developing unmanned surface vessels for automated waterbody cleaning and real-time water quality monitoring, optimized for both government and private sectors.",https://eunoiainnovations.in,India,https://www.linkedin.com/company/eunoia-innovations/about/,2021,,Seed,Industry,Wastewater,Prototype,"AIC T-hub, D Labs",Alankar Achadian,https://www.linkedin.com/in/alankars-ak/,Founder & Executive Officer,Aashish Sharma,https://www.linkedin.com/in/aashishsharma-designengineer/,COO,Deepak Cheran E,https://www.linkedin.com/in/deepakcheran-navalarchitect/,Co-founder,,,,,,,,,
Almericus,Aquaculture climate tech with blue carbon solutions that protect ecosystems while unlocking carbon credits.,https://www.almericus.in,India,https://www.linkedin.com/company/almericus/about/,2022,,Pre-Seed,Food & land use,Aquaculture,R&D,,Kumar Gurusamy,https://www.linkedin.com/in/kg-9444715b/,Founder & CEO,,,,,,,,,,,,,,,
ASMI Innovations,"Creating water purification systems that recycle RO waste, integrating IoT-based real-time monitoring to ensure water quality and sustainability.",,India,https://www.linkedin.com/company/asmi-innovations1/about/,2022,,Pre-Seed,Industry,Wastewater,R&D,,Dr. Swati Ghosh Acharyya,https://www.linkedin.com/in/dr-swati-ghosh-acharyya-b05904269/,Founder & Director,Priyabrata Patra,,Founder,,,,,,,,,,,,
NST Hitech Recycling,"Automotive circular economy by leveraging advanced, eco-efficient processes to minimize waste and slash steel scrap.",https://www.nstscrap.com,India,,2021,,Pre-Seed,Industry,Waste & recycling,Pilot,,Syed Sultan,,Founder,,,,,,,,,,,,,,,
Mati Carbon,Deploying enhanced rock weathering to remove CO₂ and restore soil health.,https://www.mati.earth,India,https://www.linkedin.com/company/maticarbon/posts/?feedView=all,2022,,Pre-Seed,Carbon,"Carbon removal, Crop yield",Pilot,Remove,Shantanu Agarwal,https://www.linkedin.com/in/shantanuagarwal/,Founder & CEO,,,,,,,,,,,,,,,
MittiLabs,Helping companies confidently invest in high-quality sustainable Rice projects.,https://www.mittilabs.earth,India,https://www.linkedin.com/company/mitti-labs/posts/?feedView=all,2023,6,Seed,Food & land use,"Sustainable finance, Crop yield",Launch,"Remove, Lightspeed Venture Partners",Devdut Dalal,https://www.linkedin.com/in/devdutdalal/,Co-Founder,Nathan Torbick,https://www.linkedin.com/in/nathantorbick/,Co-founder,Xavier Laguarta Soler,https://www.linkedin.com/in/xavier-laguarta-soler-2a145869/,Co-founder,,,,,,,,,
Greenie Energy,Provides AI-driven energy management solutions for distributed energy resources.,https://greenie-energy.com,India,https://www.linkedin.com/company/greenie-energy-technologies-pvt-ltd/,2020,0.724,Seed,Energy,"DERs - Distributed energy resources, Grid management",Pilot,AIC-Pinnacle,Istayak Ansari,https://www.linkedin.com/in/istayak-ansari-861a1678/,Co-founder & Director,,,,,,,,,,,,,,,
Vcrave Foods,"Specializes in plant-based mayonnaise, spreads, and healthy beverages.",https://www.vcravefoods.com,India,https://www.linkedin.com/company/vcravefoods/,2024,,Pre-Seed,Food & land use,Alternative foods,Prototype,,Suhail Jindran,https://www.linkedin.com/in/suhail-jindran/,Founder,,,,,,,,,,,,,,,
BioFizz,"Formulation technology that transforms agrochemicals into precisely dosed, solvent-free effervescent tablets.",https://biofizzag.com,India,https://www.linkedin.com/company/biofizz-ag-pvt-ltd/,2024,,Pre-Seed,Food & land use,"Fertilizer / pesticides, Crop yield",Launch,,Narender Kaushal,https://www.linkedin.com/in/narender-kaushal-4a6ba51b/,CEO,Yuvraj Patil,https://www.linkedin.com/in/yuvraj-patil-bb2582160/,CMD,,,,,,,,,,,,
Vyoum Biotech,Developing sprout protein isolates for the fitness and wellness industries.,https://vyoumbiotech.com,India,https://www.linkedin.com/company/vyoum-biotech/?originalSubdomain=in,2023,,Pre-Seed,Food & land use,Alternative foods,Prototype,SGSITS Incubation Forum,Vyoum Patidar,https://www.linkedin.com/in/vyoum-patidar-459a9028b/,CEO,,,,,,,,,,,,,,,
